{
  "schema_version": "v1",
  "dossier_id": "sanitised-review-dossier-913bb943b507",
  "derivedFromDossierId": "contaminant-monitoring-review-dossier-5383b8273189",
  "bundleProfile": "sanitised_public",
  "dossier_status": "open",
  "sourceWorkflow": "contaminant_monitoring_review_dossier",
  "publicReviewBundle": {
    "schema_version": "v1",
    "bundleProfile": "sanitised_public",
    "sourceBundleId": "contaminant-monitoring-bundle-45467bd7a63b",
    "sourcePacketId": "contaminant-monitoring-signoff-e3fc6dccfe07",
    "checkStatus": "pass",
    "overallSignoffStatus": "open",
    "contaminantFamily": "mercury_food_contaminants",
    "jurisdiction": "eu",
    "authority": null,
    "datasetId": "efsa.comprehensive_food_consumption_db.mercury_support",
    "overallSubmissionUse": "allowed",
    "submissionCandidateAllowed": true,
    "reportingProfileSummary": null,
    "pendingActionIds": [
      "review_header_resolution_and_quality_flags",
      "review_occurrence_evidence_context",
      "review_analytical_method_context",
      "review_linked_focus_records",
      "review_scientific_ledger.row_level_lod_coverage",
      "review_scientific_ledger.lower_bound_handling.eu.mercury.occurrence_evidence.official_monitoring_context",
      "review_scientific_ledger.storage_stability.eu.mercury.analytical_method_evidence.official_control",
      "review_scientific_ledger.sampling_plan.eu.mercury.analytical_method_evidence.official_control",
      "review_governance_links"
    ],
    "acknowledgedActionIds": [],
    "completedActionIds": [],
    "waivedActionIds": [],
    "unresolvedBlockingActionIds": [
      "review_governance_links"
    ],
    "referencedResources": [
      {
        "role": "documentation",
        "uri": "docs://contaminant-monitoring-interpretation",
        "description": "Operator documentation describing the contaminant monitoring interpretation bundle workflow.",
        "confidentialityTag": "public",
        "sanitisationState": "retained"
      },
      {
        "role": "check_workflow_documentation",
        "uri": "docs://contaminant-monitoring-import",
        "description": "Operator documentation for contaminant monitoring import checks.",
        "confidentialityTag": "public",
        "sanitisationState": "retained"
      },
      {
        "role": "occurrence_evidence_manifest",
        "uri": "occurrence-evidence://manifest",
        "description": "Governed occurrence-evidence manifest used to anchor contaminant monitoring review context.",
        "confidentialityTag": "public",
        "sanitisationState": "retained"
      },
      {
        "role": "occurrence_evidence_family",
        "uri": "occurrence-evidence://family/mercury_food_contaminants",
        "description": "Family-specific occurrence-evidence records used in this monitoring interpretation bundle.",
        "confidentialityTag": "public",
        "sanitisationState": "retained"
      },
      {
        "role": "analytical_method_evidence_manifest",
        "uri": "analytical-method-evidence://manifest",
        "description": "Governed analytical-method-evidence manifest used to anchor method-review context.",
        "confidentialityTag": "public",
        "sanitisationState": "retained"
      },
      {
        "role": "analytical_method_evidence_family",
        "uri": "analytical-method-evidence://family/mercury_food_contaminants",
        "description": "Family-specific analytical-method-evidence records used in this monitoring interpretation bundle.",
        "confidentialityTag": "public",
        "sanitisationState": "retained"
      },
      {
        "role": "occurrence_documentation",
        "uri": "docs://occurrence-evidence-registry",
        "description": "Operator documentation for governed occurrence-evidence records.",
        "confidentialityTag": "public",
        "sanitisationState": "retained"
      },
      {
        "role": "analytical_method_documentation",
        "uri": "docs://analytical-method-evidence-registry",
        "description": "Operator documentation for governed analytical-method-evidence records.",
        "confidentialityTag": "public",
        "sanitisationState": "retained"
      },
      {
        "role": "reporting_profiles_manifest",
        "uri": "reporting-profiles://manifest",
        "description": "Governed reporting-profile manifest covering primary EU and optional advisory reporting conventions.",
        "confidentialityTag": "public",
        "sanitisationState": "retained"
      },
      {
        "role": "reporting_profiles_family",
        "uri": "reporting-profiles://family/mercury_food_contaminants",
        "description": "Family-specific governed reporting profiles considered during monitoring interpretation.",
        "confidentialityTag": "public",
        "sanitisationState": "retained"
      },
      {
        "role": "reporting_profiles_documentation",
        "uri": "docs://reporting-profiles-registry",
        "description": "Operator guidance for governed reporting-profile usage and non-substitution posture.",
        "confidentialityTag": "public",
        "sanitisationState": "retained"
      },
      {
        "role": "contaminant_legal_limits_manifest",
        "uri": "contaminant-legal-limits://manifest",
        "description": "Governed contaminant legal-limit manifest used to keep jurisdiction-specific legal-limit support explicit during monitoring review.",
        "confidentialityTag": "public",
        "sanitisationState": "retained"
      },
      {
        "role": "contaminant_legal_limits_family",
        "uri": "contaminant-legal-limits://family/mercury_food_contaminants",
        "description": "Family-specific governed contaminant legal-limit records considered alongside the monitoring interpretation bundle.",
        "confidentialityTag": "public",
        "sanitisationState": "retained"
      },
      {
        "role": "jurisdiction_coverage_manifest",
        "uri": "jurisdiction-coverage://manifest",
        "description": "Machine-readable jurisdiction-coverage manifest used to keep support depth explicit during monitoring review.",
        "confidentialityTag": "public",
        "sanitisationState": "retained"
      },
      {
        "role": "jurisdiction_coverage_jurisdiction",
        "uri": "jurisdiction-coverage://jurisdiction/eu",
        "description": "Jurisdiction-scoped coverage posture used to avoid overreading partial or missing legal-limit support.",
        "confidentialityTag": "public",
        "sanitisationState": "retained"
      },
      {
        "role": "contaminant_legal_limits_jurisdiction",
        "uri": "contaminant-legal-limits://jurisdiction/eu",
        "description": "Jurisdiction-scoped contaminant legal-limit records used to keep the monitoring review lane explicit.",
        "confidentialityTag": "public",
        "sanitisationState": "retained"
      },
      {
        "role": "metals_review_focus_manifest",
        "uri": "metals-review-focus://manifest",
        "description": "Governed metals review-focus registry used to surface linked commodity and population follow-up context.",
        "confidentialityTag": "public",
        "sanitisationState": "retained"
      },
      {
        "role": "metals_review_focus_family",
        "uri": "metals-review-focus://family/mercury_food_contaminants",
        "description": "Family-specific review-focus records linked from the contaminant monitoring check result.",
        "confidentialityTag": "public",
        "sanitisationState": "retained"
      },
      {
        "role": "emerging_family_governance",
        "uri": "emerging-contaminants://family/mercury_food_contaminants",
        "description": "Family-level evidence-maturity and submission-governance posture for this contaminant family.",
        "confidentialityTag": "public",
        "sanitisationState": "retained"
      },
      {
        "role": "contaminant_monitoring_signoff_docs",
        "uri": "docs://contaminant-monitoring-signoff",
        "description": "Operator guide for reviewer-facing contaminant monitoring signoff packets.",
        "confidentialityTag": "public",
        "sanitisationState": "retained"
      }
    ],
    "notes": [
      "Sanitised public contaminant monitoring bundle retains governed signoff state, legal-limit posture, and non-confidential review resources only.",
      "Confidential fields and resources are represented in sanitisation_records rather than exposed directly.",
      "Contaminant monitoring import checks validate supplied CSV text against governed occurrence and analytical-method evidence objects.",
      "This workflow is review-oriented and does not create a native contaminant exposure engine or final regulatory decision.",
      "Occurrence-evidence record eu.mercury.occurrence_evidence.official_monitoring_context: Supporting sources mix historical anchors (efsa.mercury.food.2012) with newer context records (efsa.mercury.fish_consumption.2026, efsa.metals.topic.2026, eu.reg.2023_915, eu.reg.333_2007); confirm the older evidence base is still fit for the intended use.",
      "Occurrence-evidence record eu.mercury.occurrence_evidence.official_monitoring_context still depends on older supporting sources (efsa.mercury.food.2012) even though newer context records are also linked.",
      "Analytical-method-evidence record eu.mercury.analytical_method_evidence.official_control: Supporting sources mix historical anchors (efsa.mercury.food.2012) with newer context records (eu.reg.2023_915, eu.reg.333_2007); confirm the older evidence base is still fit for the intended use.",
      "Analytical-method-evidence record eu.mercury.analytical_method_evidence.official_control still depends on older supporting sources (efsa.mercury.food.2012) even though newer context records are also linked.",